### ISSUE TITLE
rpyc uses a lot of bandwidth

### ISSUE THREAD

**Issue by Thordin** [tomerfiliba/rpyc#331]
This seems to use a lot of bandwidth. 

Using a function that takes 1 variable and returns it with an integer seems to take 295 bytes.

##### Environment

- rpyc version: 4.1.0
- python version: 3.6.7
- operating system: Ubuntu 18.04 x64

##### Minimal example

Client

```
import rpyc

c = rpyc.connect("127.0.0.1", 5001)
c.root.exposed_test(123)
```

Server
```
import rpyc
from rpyc.utils.server import ThreadedServer

class Service(rpyc.Service):
    def exposed_test(self, a):
        return a

t = ThreadedServer(Service, port=5001)
t.start()
```

tcpdump after connect fires.

```
16:05:54.599262 IP 127.0.0.1.34610 > 127.0.0.1.5001: Flags [P.], seq 290:370, ack 1378, win 1365, options [nop,nop,TS val 2631238375 ecr 2631217421], length 80
16:05:54.600370 IP 127.0.0.1.5001 > 127.0.0.1.34610: Flags [P.], seq 1378:1435, ack 370, win 342, options [nop,nop,TS val 2631238376 ecr 2631238375], length 57
16:05:54.600394 IP 127.0.0.1.34610 > 127.0.0.1.5001: Flags [.], ack 1435, win 1365, options [nop,nop,TS val 2631238376 ecr 2631238376], length 0
16:05:54.601555 IP 127.0.0.1.34610 > 127.0.0.1.5001: Flags [P.], seq 370:439, ack 1435, win 1365, options [nop,nop,TS val 2631238378 ecr 2631238376], length 69
16:05:54.601782 IP 127.0.0.1.5001 > 127.0.0.1.34610: Flags [P.], seq 1435:1447, ack 439, win 342, options [nop,nop,TS val 2631238378 ecr 2631238378], length 12
16:05:54.602081 IP 127.0.0.1.34610 > 127.0.0.1.5001: Flags [P.], seq 439:504, ack 1447, win 1365, options [nop,nop,TS val 2631238378 ecr 2631238378], length 65
16:05:54.602273 IP 127.0.0.1.5001 > 127.0.0.1.34610: Flags [P.], seq 1447:1459, ack 504, win 342, options [nop,nop,TS val 2631238378 ecr 2631238378], length 12
16:05:54.644855 IP 127.0.0.1.34610 > 127.0.0.1.5001: Flags [.], ack 1459, win 1365, options [nop,nop,TS val 2631238421 ecr 2631238378], length 0
```

So you can see here a simple function with 1 int variable that returns an int results in 295 bytes sent over the wire.

**Comment by comrumino** [comment]
In a more general sense, this is on my radar. I'd like to make a unit test to measure the bandwidth without having to whip out wireshark or tcpdump.

**Comment by comrumino** [comment]
### Collect PCAPs for RPyC and HTTP
- [ ] Large 200MB file
- [ ] Built-in types
- [ ] Nested built-in types
- [ ] Serialized user defined classes

### Analyze data for net gains
- [ ] treemap of PCAPs for each case and overall
- [ ] comparative analysis of RPyC and HTTP

### Implement best approach
- [ ] Design: cohesion, coherence, ease of extension/contraction, self-documenting, and simple

**Comment by comrumino** [comment]
Low priority compared to other issues. Might be a while before this is back "In Progress."

**Comment by comrumino** [comment]
Tracking at #326
